{"accepted":true,"accepted_promotions":1,"bundle_manifest_hash":"2426a8f5d4c4f0d327d55970b43441c274ca9b672a4280914a37a55b2ee31661","candidate_builder_invocations":0,"dynamic_task_replays":4,"final_m9_semantic_package_hash":"a20e01b73f6b6ab069ce93bcbb43d5b745d3210268a4f958be5e744057e53dc6","final_store_package_hash":"2fd9aad1e508dae645e20b2545e274c1034fde109b6c2f4d5659eb17497bf472","forbidden_worker_modules":[],"gate_d_replays":1,"gate_e_closed":false,"gate_e_replays":1,"generator_invocations":0,"immutable_packages_verified":10,"manual_repairs":0,"outer_replays":1,"phase15_exit_closed":false,"pinned_lean":true,"planner_invocations":0,"platform_id":"ubuntu","proposal_worker_invocations":0,"protected_task_replays":22,"rejected_attempts":1,"report_hash":"b619091a4e19b3d44c32d279f5cf89f675d08ee0620d1baaf32a374a6ad72671","schema_id":"runtime.v4.phase15.replay_report.v1","semantic_replay_accepted":true,"source_head":"ba9163c4ab4e3dbc7496cacb004af7f7fe4289da","source_tree":"6c709a75c0c575aae44a8b9551b7dd48a408d4ec","training_invocations":0,"trajectory_report_hash":"0ed512aee0a7b75a8e533e189a2dec9840995ba9d583de175981dc931adc5b94"}